{
  "contractSchema": "schemas/hermes-xcore-event-profile-v1.schema.json",
  "schemaVersion": "1.0.0",
  "contractId": "helios-hermes-xcore-event-profile-v1",
  "eventEnvelope": {
    "requiredFields": [
      "eventId",
      "correlationId",
      "source",
      "eventType",
      "environment",
      "dataClassification",
      "actor",
      "evidenceLinks",
      "occurredAt"
    ],
    "classifications": [
      "public",
      "internal",
      "restricted"
    ],
    "correlationIdRequired": true,
    "evidenceLinksRequired": true
  },
  "delivery": {
    "semantics": "at-least-once",
    "idempotency": {
      "required": true,
      "keyFields": [
        "eventId",
        "correlationId",
        "source",
        "eventType"
      ]
    },
    "replayProtection": {
      "required": true,
      "maxAgeMinutes": 1440,
      "requireNonce": true
    },
    "leaseFencing": {
      "required": true,
      "leaseOwnerField": "leaseOwner",
      "leaseExpiryField": "leaseExpiresAt",
      "etagField": "etag",
      "compareAndSwapRequired": true
    }
  }
}
